{
 "schema": "mrm/machine/1",
 "name": "Collatz (deterministic)",
 "description": "The paper's Collatz machine with the branch replaced by a parity test, matching the notebook's collatzSimulate. The states graph is a single trajectory.",
 "n_registers": 2,
 "rules": [
  {
   "id": "i1s1",
   "pc_from": 1,
   "guard": [
    {
     "reg": 2,
     "op": ">",
     "value": 0
    }
   ],
   "updates": [
    {
     "reg": 2,
     "delta": -1
    }
   ],
   "pc_to": 2
  },
  {
   "id": "i1f1",
   "pc_from": 1,
   "guard": [
    {
     "reg": 2,
     "op": "==",
     "value": 0
    }
   ],
   "updates": [],
   "pc_to": 8
  },
  {
   "id": "i2s1",
   "pc_from": 2,
   "guard": [],
   "updates": [
    {
     "reg": 1,
     "delta": 1
    }
   ],
   "pc_to": 3
  },
  {
   "id": "i3s1",
   "pc_from": 3,
   "guard": [],
   "updates": [
    {
     "reg": 1,
     "delta": 1
    }
   ],
   "pc_to": 4
  },
  {
   "id": "i4s1",
   "pc_from": 4,
   "guard": [],
   "updates": [
    {
     "reg": 1,
     "delta": 1
    }
   ],
   "pc_to": 1
  },
  {
   "id": "i5s1",
   "pc_from": 5,
   "guard": [],
   "updates": [
    {
     "reg": 1,
     "delta": 1
    }
   ],
   "pc_to": 6
  },
  {
   "id": "i6s1",
   "pc_from": 6,
   "guard": [
    {
     "reg": 2,
     "op": ">",
     "value": 0
    }
   ],
   "updates": [
    {
     "reg": 2,
     "delta": -1
    }
   ],
   "pc_to": 7
  },
  {
   "id": "i6f1",
   "pc_from": 6,
   "guard": [
    {
     "reg": 2,
     "op": "==",
     "value": 0
    }
   ],
   "updates": [],
   "pc_to": 8
  },
  {
   "id": "i7s1",
   "pc_from": 7,
   "guard": [
    {
     "reg": 2,
     "op": ">",
     "value": 0
    }
   ],
   "updates": [
    {
     "reg": 2,
     "delta": -1
    }
   ],
   "pc_to": 5
  },
  {
   "id": "i7f1",
   "pc_from": 7,
   "guard": [
    {
     "reg": 2,
     "op": "==",
     "value": 0
    }
   ],
   "updates": [],
   "pc_to": 8
  },
  {
   "id": "i8s1",
   "pc_from": 8,
   "guard": [
    {
     "reg": 1,
     "op": ">",
     "value": 0
    }
   ],
   "updates": [
    {
     "reg": 1,
     "delta": -1
    }
   ],
   "pc_to": 9
  },
  {
   "id": "i8odd",
   "pc_from": 8,
   "guard": [
    {
     "reg": 1,
     "op": "==",
     "value": 0
    },
    {
     "reg": 2,
     "op": "%==",
     "value": 1,
     "modulus": 2
    }
   ],
   "updates": [],
   "pc_to": 4
  },
  {
   "id": "i8even",
   "pc_from": 8,
   "guard": [
    {
     "reg": 1,
     "op": "==",
     "value": 0
    },
    {
     "reg": 2,
     "op": "%==",
     "value": 0,
     "modulus": 2
    }
   ],
   "updates": [],
   "pc_to": 6
  },
  {
   "id": "i9s1",
   "pc_from": 9,
   "guard": [],
   "updates": [
    {
     "reg": 2,
     "delta": 1
    }
   ],
   "pc_to": 8
  }
 ],
 "halt_pcs": [],
 "initial": [
  8,
  [
   0,
   7
  ]
 ]
}
