{
 "schema": "mrm/machine/1",
 "name": "Collatz (multiway, from the paper)",
 "description": "The paper's Collatz machine. At each odometer state (pc 8 with register 1 empty) it branches to both the 3n + 1 and the halving section, generating all interleavings.",
 "n_registers": 2,
 "rules": [
  {
   "id": "i1s1",
   "pc_from": 1,
   "guard": [
    {
     "reg": 2,
     "op": ">",
     "value": 0
    }
   ],
   "updates": [
    {
     "reg": 2,
     "delta": -1
    }
   ],
   "pc_to": 2
  },
  {
   "id": "i1f1",
   "pc_from": 1,
   "guard": [
    {
     "reg": 2,
     "op": "==",
     "value": 0
    }
   ],
   "updates": [],
   "pc_to": 8
  },
  {
   "id": "i2s1",
   "pc_from": 2,
   "guard": [],
   "updates": [
    {
     "reg": 1,
     "delta": 1
    }
   ],
   "pc_to": 3
  },
  {
   "id": "i3s1",
   "pc_from": 3,
   "guard": [],
   "updates": [
    {
     "reg": 1,
     "delta": 1
    }
   ],
   "pc_to": 4
  },
  {
   "id": "i4s1",
   "pc_from": 4,
   "guard": [],
   "updates": [
    {
     "reg": 1,
     "delta": 1
    }
   ],
   "pc_to": 1
  },
  {
   "id": "i5s1",
   "pc_from": 5,
   "guard": [],
   "updates": [
    {
     "reg": 1,
     "delta": 1
    }
   ],
   "pc_to": 6
  },
  {
   "id": "i6s1",
   "pc_from": 6,
   "guard": [
    {
     "reg": 2,
     "op": ">",
     "value": 0
    }
   ],
   "updates": [
    {
     "reg": 2,
     "delta": -1
    }
   ],
   "pc_to": 7
  },
  {
   "id": "i6f1",
   "pc_from": 6,
   "guard": [
    {
     "reg": 2,
     "op": "==",
     "value": 0
    }
   ],
   "updates": [],
   "pc_to": 8
  },
  {
   "id": "i7s1",
   "pc_from": 7,
   "guard": [
    {
     "reg": 2,
     "op": ">",
     "value": 0
    }
   ],
   "updates": [
    {
     "reg": 2,
     "delta": -1
    }
   ],
   "pc_to": 5
  },
  {
   "id": "i7f1",
   "pc_from": 7,
   "guard": [
    {
     "reg": 2,
     "op": "==",
     "value": 0
    }
   ],
   "updates": [],
   "pc_to": 8
  },
  {
   "id": "i8s1",
   "pc_from": 8,
   "guard": [
    {
     "reg": 1,
     "op": ">",
     "value": 0
    }
   ],
   "updates": [
    {
     "reg": 1,
     "delta": -1
    }
   ],
   "pc_to": 9
  },
  {
   "id": "i8f1",
   "pc_from": 8,
   "guard": [
    {
     "reg": 1,
     "op": "==",
     "value": 0
    }
   ],
   "updates": [],
   "pc_to": 4
  },
  {
   "id": "i8f2",
   "pc_from": 8,
   "guard": [
    {
     "reg": 1,
     "op": "==",
     "value": 0
    }
   ],
   "updates": [],
   "pc_to": 6
  },
  {
   "id": "i9s1",
   "pc_from": 9,
   "guard": [],
   "updates": [
    {
     "reg": 2,
     "delta": 1
    }
   ],
   "pc_to": 8
  }
 ],
 "halt_pcs": [],
 "instructions": [
  [
   2,
   1,
   [
    2
   ],
   [
    8
   ]
  ],
  [
   1,
   0,
   [
    3
   ]
  ],
  [
   1,
   0,
   [
    4
   ]
  ],
  [
   1,
   0,
   [
    1
   ]
  ],
  [
   1,
   0,
   [
    6
   ]
  ],
  [
   2,
   1,
   [
    7
   ],
   [
    8
   ]
  ],
  [
   2,
   1,
   [
    5
   ],
   [
    8
   ]
  ],
  [
   1,
   1,
   [
    9
   ],
   [
    4,
    6
   ]
  ],
  [
   2,
   0,
   [
    8
   ]
  ]
 ],
 "initial": [
  8,
  [
   0,
   5
  ]
 ]
}
